[
  {
    "routeId": "first_aid.root",
    "category": "clinical",
    "presentation": "flex",
    "text": "เมื่อบุคลากรทางการแพทย์สัมผัสเลือดหรือสารคัดหลั่ง ให้รีบปฐมพยาบาลตามกรณีดังต่อไปนี้",
    "source": {
      "version": "revision-3-2026-09-03",
      "pages": [
        1
      ]
    },
    "next": [
      {
        "routeId": "first_aid.sharp_skin",
        "label": "เข็ม/ของมีคม/ผิวหนัง"
      },
      {
        "routeId": "first_aid.eye",
        "label": "กระเด็นเข้าตา"
      },
      {
        "routeId": "first_aid.mouth",
        "label": "กระเด็นเข้าปาก"
      }
    ],
    "enabled": true
  },
  {
    "routeId": "first_aid.sharp_skin",
    "category": "clinical",
    "presentation": "flex",
    "text": "กรณีถูกเข็มหรือของมีคมที่เปื้อนเลือดหรือสารคัดหลั่งตำหรือบาด หรือเลือดหรือสารคัดหลั่งกระเด็นถูกผิวหนังที่ไม่ปกติ : ไม่ต้องบีบเค้นบริเวณที่สัมผัส ให้ล้างด้วยน้ำสะอาด หรือสบู่ แล้วเช็ดด้วย 70% Alcohol หรือ Betadine solution หรือ 5% Chlorhexidine gluconate",
    "source": {
      "version": "revision-3-2026-09-03",
      "pages": [
        1
      ]
    },
    "next": [
      {
        "routeId": "notify",
        "label": "แจ้งและบันทึก"
      }
    ],
    "enabled": true
  },
  {
    "routeId": "first_aid.eye",
    "category": "clinical",
    "presentation": "flex",
    "text": "กรณีเลือดหรือสารคัดหลั่งกระเด็นเข้าตา : ล้างตาด้วยน้ำสะอาดหรือ NSS มากๆ",
    "source": {
      "version": "revision-3-2026-09-03",
      "pages": [
        1
      ]
    },
    "next": [
      {
        "routeId": "notify",
        "label": "แจ้งและบันทึก"
      }
    ],
    "enabled": true
  },
  {
    "routeId": "first_aid.mouth",
    "category": "clinical",
    "presentation": "flex",
    "text": "กรณีเลือดหรือสารคัดหลั่งกระเด็นเข้าปาก: บ้วนปากและกลั้วคอด้วยน้ำสะอาดหรือ NSS",
    "source": {
      "version": "revision-3-2026-09-03",
      "pages": [
        1
      ]
    },
    "next": [
      {
        "routeId": "notify",
        "label": "แจ้งและบันทึก"
      }
    ],
    "enabled": true
  },
  {
    "routeId": "notify",
    "category": "clinical",
    "presentation": "flex",
    "text": "หลังการปฐมพยาบาล ให้ดำเนินการตามขั้นตอนดังนี้\n1. แจ้งพยาบาลหัวหน้าเวรประจำหน่วยงานที่บุคลากรเกิดอุบัติเหตุ\n2. ซักประวัติรายละเอียดของการสัมผัสความเสี่ยงของผู้ป่วยและบันทึกหลักฐาน",
    "source": {
      "version": "revision-3-2026-09-03",
      "pages": [
        1
      ]
    },
    "next": [
      {
        "routeId": "lab.source.ic04",
        "label": "ตรวจเลือดผู้ป่วย"
      }
    ],
    "enabled": true
  },
  {
    "routeId": "lab.source.ic04",
    "category": "clinical",
    "presentation": "flex",
    "text": "เจาะเลือดผู้ป่วย โดย Request lab ในแถบ Method Code : IC04 Lab for needle injury\n(ตรวจ Anti HIV (rapid test), HBsAg, Anti HCV)",
    "source": {
      "version": "revision-3-2026-09-03",
      "pages": [
        1
      ]
    },
    "next": [
      {
        "routeId": "lab.source.negative",
        "label": "ผล Negative ทุกตัว"
      },
      {
        "routeId": "lab.source.positive",
        "label": "ผล Positive อย่างน้อยหนึ่งตัว"
      },
      {
        "routeId": "lab.source.opd",
        "label": "กรณี OPD"
      }
    ],
    "enabled": true
  },
  {
    "routeId": "lab.source.opd",
    "category": "clinical",
    "presentation": "flex",
    "text": "กรณีเกิดอุบัติเหตุผู้ป่วย OPD ให้พยาบาลประจำ OPD เป็นผู้ Pre counselling ผู้ป่วย และนำส่งผู้ป่วยเจาะเลือดที่ ห้องเจาะเลือด",
    "source": {
      "version": "revision-3-2026-09-03",
      "pages": [
        1
      ]
    },
    "next": [
      {
        "routeId": "lab.source.ic04",
        "label": "ตรวจเลือดผู้ป่วย"
      }
    ],
    "enabled": true
  },
  {
    "routeId": "lab.source.negative",
    "category": "clinical",
    "presentation": "flex",
    "text": "กรณีที่ 1: ผล Negative ทุกตัว\nไม่ต้องให้ oPEP (1) และไม่ต้องติดตามบุคลากรที่สัมผัส โดยให้ปฏิบัติย้อนหลังดังนี้\n1. บันทึกรายงานการเกิดอุบัติเหตุส่งงาน IC\n2. ลงอุบัติการณ์ความเสี่ยงในโปรแกรม HRMS",
    "source": {
      "version": "revision-3-2026-09-03",
      "pages": [
        1
      ]
    },
    "next": [
      {
        "routeId": "opep.request",
        "label": "ขอเจาะเลือด/ยืนยัน oPEP"
      }
    ],
    "enabled": true
  },
  {
    "routeId": "lab.source.positive",
    "category": "clinical",
    "presentation": "flex",
    "text": "กรณีที่ 2: ผล Positive ตัวใดตัวหนึ่ง",
    "source": {
      "version": "revision-3-2026-09-03",
      "pages": [
        1
      ]
    },
    "next": [
      {
        "routeId": "exposure.office",
        "label": "ในเวลาราชการ"
      },
      {
        "routeId": "exposure.after_hours",
        "label": "นอกเวลาราชการ"
      }
    ],
    "enabled": true
  },
  {
    "routeId": "exposure.office",
    "category": "clinical",
    "presentation": "flex",
    "text": "หากเหตุเกิดในเวลาราชการ\nพบ ICN กรณีผลเลือดผู้ป่วยตัวใดตัวหนึ่งบวก\nเจาะเลือดบุคลากรภายใน 24 ชม. Request lab ในแถบ Method (ในเวลาเจาะที่ห้องเจาะเลือด) ตามกรณีดังนี้",
    "source": {
      "version": "revision-3-2026-09-03",
      "pages": [
        2
      ]
    },
    "next": [
      {
        "routeId": "lab.staff.ic05",
        "label": "กรณี IC05"
      },
      {
        "routeId": "opep.office",
        "label": "oPEP ในเวลาราชการ"
      }
    ],
    "enabled": true
  },
  {
    "routeId": "exposure.after_hours",
    "category": "clinical",
    "presentation": "flex",
    "text": "หากเหตุเกิดนอกเวลาราชการ\n1. พบแพทย์ที่ ER\n2. แพทย์ ER พิจารณาให้ oPEP (2) เบื้องต้น 1-3 วัน\n3. นัด F/U ICN ในเวลาราชการ\n4. เจาะเลือดบุคลากรภายใน 24 ชม. Request lab ในแถบ Method (นอกเวลาเจาะที่ห้องฉุกเฉิน) ตามรหัส Code : IC05 หรือ Code : IC06 ข้างต้น\n5. พบแพทย์ห้องตรวจอาชีวเวชกรรมเพื่อรับ oPEP (2) ต่อ",
    "source": {
      "version": "revision-3-2026-09-03",
      "pages": [
        2
      ]
    },
    "next": [
      {
        "routeId": "lab.staff.ic05",
        "label": "กรณี IC05"
      },
      {
        "routeId": "followup.hiv",
        "label": "ติดตาม HIV"
      },
      {
        "routeId": "report.ic",
        "label": "รายงาน IC และ HRMS"
      }
    ],
    "enabled": true
  },
  {
    "routeId": "lab.staff.ic05",
    "category": "clinical",
    "presentation": "flex",
    "text": "Code : IC05 กรณีบุคลากรสัมผัสผู้ป่วย HIV หรือ Anti HCV positive (ตรวจ Anti HBS, Anti HCV, Anti HIV (Elisa) CBC, ALT, Cr)",
    "source": {
      "version": "revision-3-2026-09-03",
      "pages": [
        2
      ]
    },
    "next": [],
    "enabled": true
  },
  {
    "routeId": "lab.staff.ic06",
    "category": "clinical",
    "presentation": "text",
    "text": "Code : IC06 กรณีบุคลากรสัมผัสผู้ป่วย Anti HBsAg positive (ตรวจ Anti HBS, Anti HCV, Anti HIV (Elisa) CBC, ALT, Cr เพิ่ม HBsAg และ Anti HBc)",
    "source": {
      "version": "revision-3-2026-09-03",
      "pages": [
        2
      ]
    },
    "next": [],
    "enabled": false,
    "disabledReason": "ต้นฉบับระบุ Anti HBsAg positive แต่หน้า 1 ตรวจ HBsAg; ต้องยืนยันชื่อผลตรวจก่อนเปิด route"
  },
  {
    "routeId": "opep.office",
    "category": "clinical",
    "presentation": "flex",
    "text": "หากเหตุเกิดในเวลาราชการ\nพบแพทย์ห้องตรวจอาชีวเวชกรรม เพื่อรับ oPEP (2)",
    "source": {
      "version": "revision-3-2026-09-03",
      "pages": [
        2
      ]
    },
    "next": [
      {
        "routeId": "opep.definition",
        "label": "oPEP คืออะไร"
      },
      {
        "routeId": "opep.regimen",
        "label": "สูตรยาตามเอกสาร"
      },
      {
        "routeId": "followup.hiv",
        "label": "ติดตาม HIV"
      },
      {
        "routeId": "followup.hcv",
        "label": "ติดตาม HCV"
      },
      {
        "routeId": "cr.notes",
        "label": "ข้อพิจารณาค่า Cr"
      }
    ],
    "enabled": true
  },
  {
    "routeId": "opep.after_hours",
    "category": "clinical",
    "presentation": "flex",
    "text": "หากเหตุเกิดนอกเวลาราชการ\n1. พบแพทย์ที่ ER\n2. แพทย์ ER พิจารณาให้ oPEP (2) เบื้องต้น 1-3 วัน\n3. นัด F/U ICN ในเวลาราชการ\n4. เจาะเลือดบุคลากรภายใน 24 ชม. Request lab ในแถบ Method (นอกเวลาเจาะที่ห้องฉุกเฉิน) ตามรหัส Code : IC05 หรือ Code : IC06 ข้างต้น\n5. พบแพทย์ห้องตรวจอาชีวเวชกรรมเพื่อรับ oPEP (2) ต่อ",
    "source": {
      "version": "revision-3-2026-09-03",
      "pages": [
        2
      ]
    },
    "next": [
      {
        "routeId": "opep.definition",
        "label": "oPEP คืออะไร"
      },
      {
        "routeId": "opep.regimen",
        "label": "สูตรยาตามเอกสาร"
      },
      {
        "routeId": "followup.hiv",
        "label": "ติดตาม HIV"
      },
      {
        "routeId": "followup.hcv",
        "label": "ติดตาม HCV"
      },
      {
        "routeId": "cr.notes",
        "label": "ข้อพิจารณาค่า Cr"
      }
    ],
    "enabled": true
  },
  {
    "routeId": "opep.definition",
    "category": "clinical",
    "presentation": "text",
    "text": "oPEP = Occupational post exposure Prophylaxis",
    "source": {
      "version": "revision-3-2026-09-03",
      "pages": [
        3
      ]
    },
    "next": [],
    "enabled": true
  },
  {
    "routeId": "opep.regimen",
    "category": "clinical",
    "presentation": "text",
    "text": "สูตรยาต้านไวรัส Kocitaf (TAF/FTC/DTG) 1x1 วันละ 1 ครั้ง (จำนวน 28 เม็ด)",
    "source": {
      "version": "revision-3-2026-09-03",
      "pages": [
        3
      ]
    },
    "next": [
      {
        "routeId": "cr.notes",
        "label": "ข้อพิจารณาค่า Cr"
      }
    ],
    "enabled": true
  },
  {
    "routeId": "opep.request",
    "category": "clinical",
    "presentation": "text",
    "text": "หากบุคลากรต้องการเจาะเลือดหรือยืนยันต้องการ oPEP ให้ส่งพบ ICN เพื่อส่งเจาะเลือดตาม Standing order",
    "source": {
      "version": "revision-3-2026-09-03",
      "pages": [
        3
      ]
    },
    "next": [],
    "enabled": true
  },
  {
    "routeId": "followup.hiv",
    "category": "clinical",
    "presentation": "flex",
    "text": "ออกบัตรนัดโดยห้องตรวจอาชีวเวชกรรม เพื่อ F/U Anti HIV ที่ 1 เดือน, 3 เดือน, 6 เดือน (4)",
    "source": {